{
  "objectType": "pbpkQualificationSummary.v1",
  "objectId": "gastroplus-qualification-summary",
  "simulationId": null,
  "backend": "external-import",
  "sourcePlatform": "GastroPlus",
  "assessmentBoundary": "external-pbpk-normalization-only",
  "decisionBoundary": "no-ngra-decision-policy",
  "state": "research-use",
  "label": "Research Use",
  "summary": "External PBPK qualification metadata were normalized without executing the upstream platform.",
  "qualificationLevel": "L2",
  "oecdReadiness": "external-imported",
  "validationDecision": null,
  "withinDeclaredContext": null,
  "scientificProfile": true,
  "riskAssessmentReady": false,
  "checklistScore": null,
  "evidenceStatus": "checked",
  "profileSource": "external-import",
  "missingEvidenceCount": 0,
  "reviewStatus": {
    "status": "not-declared",
    "declaredStatus": "unreported",
    "summary": "No peer-review, reviewer stance, or prior-use workflow metadata are declared.",
    "reviewRecordCount": 0,
    "priorUseCount": 0,
    "revisionEntryCount": 0,
    "unresolvedDissentCount": 0,
    "resolvedDissentCount": 0,
    "revisionStatus": null,
    "focusTopics": [],
    "requiresReviewerAttention": true
  },
  "performanceEvidenceBoundary": "runtime-or-internal-evidence-only",
  "executableVerificationStatus": "checked",
  "platformClass": "commercial",
  "validationReferences": [],
  "evidenceBasis": {
    "basisType": "external-imported",
    "inVivoSupportStatus": "no-direct-in-vivo-support",
    "iviveLinkageStatus": "external-ivive-linkage-declared",
    "parameterizationBasis": "in-vitro-adme-and-literature",
    "populationVariabilityStatus": "declared-or-characterized"
  },
  "workflowClaimBoundaries": {
    "forwardDosimetry": "external-imported-not-executed-by-pbpk-mcp",
    "reverseDosimetry": "not-performed-directly-external-workflow-required",
    "exposureLedPrioritization": "supported-only-as-pbpk-substrate-with-external-orchestrator",
    "directRegulatoryDoseDerivation": "not-supported"
  },
  "exportBlockPolicy": {
    "policyVersion": "pbpk-export-block-policy.v1",
    "defaultAction": "block-lossy-or-decision-leaning-exports",
    "contextualizedRenderOnly": true,
    "workflow": "exposure-led-ngra",
    "blockedViewModes": [
      "report-card",
      "screenshot",
      "chat-snippet",
      "forwarded-bundle",
      "thin-api-response"
    ],
    "requiredFields": [
      "qualificationState",
      "reviewStatus",
      "evidenceBasis",
      "claimBoundaries",
      "misreadRiskSummary.plainLanguageSummary",
      "summaryTransportRisk.plainLanguageSummary"
    ],
    "blockReasons": [
      {
        "code": "detached-summary-blocked",
        "severity": "high",
        "appliesTo": [
          "report-card",
          "screenshot",
          "chat-snippet",
          "forwarded-bundle",
          "thin-api-response"
        ],
        "message": "Block lossy report cards, screenshots, chat snippets, or forwarded bundles when qualification state, review status, evidence basis, claim boundaries, and anti-misread guidance cannot travel with them.",
        "currentStatus": "high",
        "requiredFields": [
          "qualificationState",
          "reviewStatus",
          "evidenceBasis",
          "claimBoundaries",
          "misreadRiskSummary.plainLanguageSummary",
          "summaryTransportRisk.plainLanguageSummary"
        ]
      },
      {
        "code": "direct-regulatory-dose-derivation-blocked",
        "severity": "high",
        "appliesTo": [
          "regulatory-dose-claim",
          "regulatory-decision-summary",
          "decision-recommendation"
        ],
        "message": "Block downstream presentations that frame this PBPK output as a direct regulatory dose derivation or final decision recommendation.",
        "currentStatus": "not-supported"
      }
    ],
    "notes": [
      "This policy is descriptive and machine-readable so analyst-facing clients can refuse unsafe thin views.",
      "Imported or operator-reviewed state does not create regulatory decision authority inside PBPK MCP."
    ]
  },
  "cautionSummary": {
    "summaryVersion": "pbpk-caution-summary.v1",
    "highestSeverity": "high",
    "blockingCount": 3,
    "advisoryCount": 1,
    "requiresHumanReview": true,
    "blockingRecommended": true,
    "cautions": [
      {
        "code": "detached-summary-overread",
        "cautionType": "summary-transport-risk",
        "severity": "high",
        "handling": "blocking",
        "scope": "summary-surface",
        "sourceSurface": "exportBlockPolicy",
        "message": "Thin report cards, screenshots, or forwarded imported summaries can detach the trust-bearing PBPK label from the caveats it needs.",
        "currentStatus": "detached-summary-unsafe",
        "requiresHumanReview": true
      },
      {
        "code": "direct-regulatory-dose-derivation-blocked",
        "cautionType": "decision-overclaim-risk",
        "severity": "high",
        "handling": "blocking",
        "scope": "workflow-claim",
        "sourceSurface": "workflowClaimBoundaries",
        "message": "Imported PBPK outputs should not be presented as direct regulatory dose derivations or final decision recommendations.",
        "currentStatus": "not-supported",
        "requiresHumanReview": true
      },
      {
        "code": "risk-assessment-ready-overclaim",
        "cautionType": "decision-overclaim-risk",
        "severity": "high",
        "handling": "blocking",
        "scope": "workflow-claim",
        "sourceSurface": "qualificationState",
        "message": "Imported qualification remains bounded, so decision-ready or regulatory-ready framing should stay blocked.",
        "currentStatus": "research-use",
        "requiresHumanReview": true
      },
      {
        "code": "parameter-transfer-uncertainty",
        "cautionType": "parameter-transfer-uncertainty",
        "severity": "medium",
        "handling": "advisory",
        "scope": "model",
        "sourceSurface": "evidenceBasis",
        "message": "Parameterization depends on transferred, literature-derived, or default assumptions, so parameter-transfer uncertainty should be reviewed before stronger claims.",
        "currentStatus": "in-vitro-adme-and-literature",
        "requiresHumanReview": true
      }
    ]
  },
  "supports": {
    "nativeExecution": false,
    "externalImportNormalization": true,
    "manifestValidation": false,
    "preflightValidation": false,
    "executableVerification": false,
    "oecdDossierExport": true,
    "typedNgraHandoff": true,
    "externalBerHandoff": true,
    "regulatoryDecision": false
  },
  "requiredExternalInputs": [
    "higher-level NGRA decision policy or orchestrator outside PBPK MCP",
    "observed-vs-predicted, predictive-dataset, or external qualification evidence"
  ],
  "limitations": [
    "Imported performance evidence is limited to runtime or internal supporting evidence."
  ]
}
